{
  "run_id": "BRUTUS-RUN://PELL/2026-09-25/000001",
  "family": "BRUTUS-PELL",
  "status": "OBSERVATION",
  "source": {
    "repo": "Topbrutus/topbrutus_one",
    "commit": "906e51f97eff3dce53203a8643f996233d825431"
  },
  "compute": {
    "precision": 70,
    "deterministic": true,
    "algorithm_id": "connected-spectrum-decimal-v1"
  },
  "verification": {
    "primary": true,
    "mirror": true,
    "countertest": true,
    "precision_audit": true,
    "independent_algorithm": true
  },
  "evidence": {}
}
